{
  "schema_version": "1.0",
  "scenario": "gtm-research",
  "source": {
    "repository": "rlbsem/gtm-pipeline-orchestration",
    "commit": "81d9381169456ca8893be0ddea483296ac77e12e"
  },
  "mode": "recorded",
  "environment": "independent_synthetic_environment",
  "packaged_at": "2026-10-22T16:41:41.885417+00:00",
  "runtime": {
    "python": "3.12.14",
    "platform": "Windows-11-10.0.26200-SP0"
  },
  "artifacts": [
    {
      "path": "evaluation.json",
      "sha256": "442083b7db2f9b2e401c1c06aaa489ba4ad3c6fdfc16004ec5284ab65ec4ecfc",
      "bytes": 458520
    },
    {
      "path": "round1-evaluation.json",
      "sha256": "88a82588aa1cf5c48c0766226fc7713b0263b6fdc30d258a180ffe4538ae08bf",
      "bytes": 217760
    },
    {
      "path": "round1-sources.json",
      "sha256": "95cf14e0d656b118d3f11a481b5127f8a455442a17fc70e6afa547096565a701",
      "bytes": 51301
    },
    {
      "path": "round2-evaluation.json",
      "sha256": "04d0ae6a0e52dbdda976294b6decbb607135933957f6c6613b331f752468c1eb",
      "bytes": 120585
    },
    {
      "path": "round2-sources.json",
      "sha256": "6264c2f0d36bfaef4ef786797afcd7f0971a7d33ebb4c859fad5cf740ccaca1d",
      "bytes": 52896
    },
    {
      "path": "round3-evaluation.json",
      "sha256": "316577503ed05c4819f12f02e45263ec4ba6089fa2cacc027ebad469a8a3c488",
      "bytes": 123112
    },
    {
      "path": "round3-sources.json",
      "sha256": "1315f1bdd124ac6ead58970e38c3168d7bcf0d9b0e7185c4156262769092a05a",
      "bytes": 53672
    },
    {
      "path": "operator-proof.json",
      "sha256": "90ac9d977c378d3186569d4e2c017a73377783cdc83a01af1599c49e32494b62",
      "bytes": 60790
    },
    {
      "path": "reviewer-assessment.json",
      "sha256": "4ac9b23b0a73719ab3ea9140173cba867fb59facb4c51cef51b678b7d7c89b61",
      "bytes": 16731
    },
    {
      "path": "public-jobs.json",
      "sha256": "546befec9b8a5c02c02cd77a38adaf010d7a949d3aeb9317f6fc17499c332bdc",
      "bytes": 1462
    },
    {
      "path": "scenario.json",
      "sha256": "da7ca6c97f303c1a103431f57af110cde2668e31cbd24f05b3eb449bd48f31db",
      "bytes": 24865
    },
    {
      "path": "research-source.py",
      "sha256": "61f74870dac0631a61c7fe7b8714a848f384a254aaf404f53a0188c475f14cb9",
      "bytes": 24011
    },
    {
      "path": "browser-provenance.json",
      "sha256": "0dea78edba9c244f1e425ff9aa7128516604acaaaaa645ad047b7641161d5f78",
      "bytes": 13664
    },
    {
      "path": "browser-capture.py",
      "sha256": "45f3a342de533fae91ec4bb4f04be43ee2555a458b8a2d4fe536ff0fe7e6af89",
      "bytes": 9351
    },
    {
      "path": "regression.json",
      "sha256": "a7dab8444d584f3cebcd35f4eb683f8620ecf6700e6f4361ce902666af9422ed",
      "bytes": 12097
    },
    {
      "path": "upstream.json",
      "sha256": "2ec1f2e57274bff95b8d30d5aafde4345f20781e77e0318f8be6530cf360ba20",
      "bytes": 7037
    },
    {
      "path": "queue.json",
      "sha256": "1cd7ec54ffa320ac3c8102ffbd5987942182e07ba0037475b91d222b56a7c972",
      "bytes": 7161
    },
    {
      "path": "browser-edit.json",
      "sha256": "b264f0b8387ae3db278b04dc8f42aeb150e2dd15754f1d079edcf6408ec69072",
      "bytes": 267
    },
    {
      "path": "observation.json",
      "sha256": "b7fdce4a49438a0fb0cb4c2fff27005cabe155e3016dd8cbcaf99744d0b9c479",
      "bytes": 202
    },
    {
      "path": "timeline.json",
      "sha256": "6609dcd670fd8315687d1c91f29c408637ad90afbfffad3721a365a44bd37a41",
      "bytes": 462832
    }
  ],
  "limitations": [
    "40 model evaluation responses and a separate fresh local operator run; not the native Salesforce execution or the 120-account pipeline scenario.",
    "Synthetic January 2026 study contexts; actual model execution in October 2026. Priority is deterministic fit/signal arithmetic, not buying intent.",
    "Exact citations do not establish semantic entailment. Qualitative assessment is an AI engineering review, not a blind human SDR study.",
    "Clay/provider enrichment is fixture-based; n8n is an unexecuted reference. No prospect communications, new approvals or CRM writes occur here.",
    "One real public job API archive is a separate read-only reference. API updated_at is not publication date; real company is not a synthetic CRM target."
  ],
  "input_hashes": {
    "evaluation.json": "442083b7db2f9b2e401c1c06aaa489ba4ad3c6fdfc16004ec5284ab65ec4ecfc",
    "round1-evaluation.json": "88a82588aa1cf5c48c0766226fc7713b0263b6fdc30d258a180ffe4538ae08bf",
    "round1-sources.json": "95cf14e0d656b118d3f11a481b5127f8a455442a17fc70e6afa547096565a701",
    "round2-evaluation.json": "04d0ae6a0e52dbdda976294b6decbb607135933957f6c6613b331f752468c1eb",
    "round2-sources.json": "6264c2f0d36bfaef4ef786797afcd7f0971a7d33ebb4c859fad5cf740ccaca1d",
    "round3-evaluation.json": "316577503ed05c4819f12f02e45263ec4ba6089fa2cacc027ebad469a8a3c488",
    "round3-sources.json": "1315f1bdd124ac6ead58970e38c3168d7bcf0d9b0e7185c4156262769092a05a",
    "operator-proof.json": "90ac9d977c378d3186569d4e2c017a73377783cdc83a01af1599c49e32494b62",
    "reviewer-assessment.json": "4ac9b23b0a73719ab3ea9140173cba867fb59facb4c51cef51b678b7d7c89b61",
    "public-jobs.json": "546befec9b8a5c02c02cd77a38adaf010d7a949d3aeb9317f6fc17499c332bdc",
    "scenario.json": "da7ca6c97f303c1a103431f57af110cde2668e31cbd24f05b3eb449bd48f31db",
    "research-source.py": "61f74870dac0631a61c7fe7b8714a848f384a254aaf404f53a0188c475f14cb9",
    "browser-provenance.json": "0dea78edba9c244f1e425ff9aa7128516604acaaaaa645ad047b7641161d5f78",
    "browser-capture.py": "45f3a342de533fae91ec4bb4f04be43ee2555a458b8a2d4fe536ff0fe7e6af89",
    "regression.json": "a7dab8444d584f3cebcd35f4eb683f8620ecf6700e6f4361ce902666af9422ed"
  },
  "reproduce": [
    "python scripts/import_research.py <gtm-git-checkout>",
    "python -m revenue_lab.cli verify web/evidence/gtm-research"
  ],
  "configuration_hash": "c58add02d3849e81913bb858e3583a9488e6e1a554792b27dd289bcb238e4746"
}
