{
  "schema_version": "1.0",
  "scenario": "seller-live",
  "source": {
    "repository": "rlbsem/customer-signal-activation",
    "commit": "d5426e70b34abfd92e8bf3aaabef22aa831587f2"
  },
  "mode": "fresh_inference",
  "environment": "independent_synthetic_environment",
  "packaged_at": "2026-10-13T04:36:52.947392+00:00",
  "runtime": {
    "python": "3.12.14",
    "platform": "Windows-11-10.0.26200-SP0"
  },
  "artifacts": [
    {
      "path": "application.json",
      "sha256": "4bb09b0d055667bb29310860020cb4340045596544b4810024067888e96fa29b",
      "bytes": 18503
    },
    {
      "path": "recorded-input.json",
      "sha256": "7487bbe95886422f5fd3a7f5d8a37f15488b96d83190c0ed6e35c0af47bb6601",
      "bytes": 7764
    },
    {
      "path": "receiver.json",
      "sha256": "027db2a6d6cfd3d51bffdc98583ce2109675e67acbfa41be0243cc63ecb5f403",
      "bytes": 2904
    },
    {
      "path": "observation.json",
      "sha256": "bb2db1d65f7d2243fba1d17055edc682487d32c9c60d0849ed1d2d2ec5fcca5e",
      "bytes": 2378
    },
    {
      "path": "execution.json",
      "sha256": "1f118a8f9cd792e716ab0ff9cddc17d03e501e8982384acb734207ec70a48a2c",
      "bytes": 2288
    },
    {
      "path": "model-runtime.json",
      "sha256": "e209f68cab59548e9a7953ce6c700278141b080ec56f0d0be1644bc1aeb9840d",
      "bytes": 501
    }
  ],
  "limitations": [
    "Actual fresh local Qwen3-14B inference; automatic scenario approval is not independent human review.",
    "Synthetic local CRM effect only. Independent usefulness remains pending."
  ],
  "input_hashes": {
    "application.json": "4bb09b0d055667bb29310860020cb4340045596544b4810024067888e96fa29b",
    "recorded-input.json": "7487bbe95886422f5fd3a7f5d8a37f15488b96d83190c0ed6e35c0af47bb6601"
  },
  "reproduce": [
    "python -m revenue_lab.cli prepare seller --install",
    "python -m revenue_lab.cli run seller-live"
  ],
  "configuration_hash": "9f88a3b424e083bf971b59c047bfa36b3de4d075a9ac5eef06bf2c100324842d"
}
