{
  "schema_version": "1.0",
  "scenario": "seller-delivery",
  "source": {
    "repository": "rlbsem/customer-signal-activation",
    "commit": "d5426e70b34abfd92e8bf3aaabef22aa831587f2"
  },
  "mode": "fresh_replay",
  "environment": "independent_synthetic_environment",
  "packaged_at": "2026-10-13T00:39:44.079249+00:00",
  "runtime": {
    "python": "3.12.14",
    "platform": "Windows-11-10.0.26200-SP0"
  },
  "artifacts": [
    {
      "path": "application.json",
      "sha256": "6a43fc1ff438ae934d9b0ec36ee6a5fddc83cec60f11e4241cdc4113c0bdc418",
      "bytes": 18308
    },
    {
      "path": "recorded-input.json",
      "sha256": "7487bbe95886422f5fd3a7f5d8a37f15488b96d83190c0ed6e35c0af47bb6601",
      "bytes": 7764
    },
    {
      "path": "receiver.json",
      "sha256": "e77dd59b999416166d2daebb5656eee6424c457d8f50a02a07a3a9ed2e01de7d",
      "bytes": 2904
    },
    {
      "path": "observation.json",
      "sha256": "feb31bbe048666f15fd2d0c5188d8456220a91e264d3e02357bd451669493fd5",
      "bytes": 2378
    },
    {
      "path": "execution.json",
      "sha256": "01444af9f2cd968e543ae472f850c0670d5edd09a1d488f2fde97c2ad91aa814",
      "bytes": 2292
    }
  ],
  "limitations": [
    "Local synthetic execution, not production deployment.",
    "Recorded-response replay is not new inference; model availability is explicit."
  ],
  "input_hashes": {
    "application.json": "6a43fc1ff438ae934d9b0ec36ee6a5fddc83cec60f11e4241cdc4113c0bdc418",
    "recorded-input.json": "7487bbe95886422f5fd3a7f5d8a37f15488b96d83190c0ed6e35c0af47bb6601"
  },
  "reproduce": [
    "python -m revenue_lab.cli prepare seller --install",
    "python -m revenue_lab.cli run seller-delivery"
  ],
  "configuration_hash": "c1c624a623824719da2aceb99cf6003177c6656e815998b7286f66b01ba411b6"
}
