{
  "schema_version": "1.0",
  "scenario": "revenue-integrity",
  "source": {
    "repository": "rlbsem/enterprise-revenue-integrity-platform",
    "commit": "e2993099acaaae188aac0d83ba840cecef1c0014"
  },
  "mode": "recorded",
  "environment": "independent_synthetic_environment",
  "packaged_at": "2026-10-25T21:10:45.003082+00:00",
  "runtime": {
    "python": "3.12.14",
    "platform": "Windows-11-10.0.26200-SP0"
  },
  "artifacts": [
    {
      "path": "lifecycle.json",
      "sha256": "6f653ecbdd1c38b80c2c9bf341da879edf25953e788c3317d8dee13f19cf8c72",
      "bytes": 88788
    },
    {
      "path": "delivery.json",
      "sha256": "4a10dee0182848cbf4817ab7e9eb8afe1e2eb692dbf0c9d196af94b04a80f3d0",
      "bytes": 119914
    },
    {
      "path": "software.json",
      "sha256": "f35dd49771f7f8ba493bd62c516686e6ceaace735347b325f136df9b27fbc189",
      "bytes": 17870
    },
    {
      "path": "process-death.json",
      "sha256": "7f634e61fafe0d9fa33527c2dcc3ee56a61965173b90a947c8096b9129b4e4b5",
      "bytes": 202
    },
    {
      "path": "history-rehydration.json",
      "sha256": "a601e4b60054652a763ab5139905222c819d6d50bf54f9d9fedfdbff2b34dbc0",
      "bytes": 161
    },
    {
      "path": "publication-process-death.json",
      "sha256": "88325acdb5d28bf76288b1fe68832e1b8fc1ae0abfbdda640568b9abcb33a1e2",
      "bytes": 129
    },
    {
      "path": "operator-browser.json",
      "sha256": "283ccc2849826731532cf29f6d2b4ae2bcb0aedebb53dbb0cea2f3723882c381",
      "bytes": 4207
    },
    {
      "path": "source-console.py",
      "sha256": "f4b41a896e39dd9254b9f1c7c920f9c0b91d5549dcabd125e0857895f36a5818",
      "bytes": 6756
    },
    {
      "path": "source-browser.cjs",
      "sha256": "e60573e6ac25b6343fd472fb0f83cc6d81ecf98d149586cb7cb17fe066a58e19",
      "bytes": 10539
    },
    {
      "path": "upstream.json",
      "sha256": "247424d037b93e7804c1808bff86c50354e8646cd989e8bf6f48a7b99b1bb61f",
      "bytes": 4039
    },
    {
      "path": "projection.json",
      "sha256": "a6860e3ff43282eea7212d196deb9a90e5a0e634dd688ccb936569356feec425",
      "bytes": 17310
    },
    {
      "path": "observation.json",
      "sha256": "e3e0a819b78726a1d8b9e87c86951ab08bc69d7e92460a9ac11821e5d9ba1882",
      "bytes": 140
    },
    {
      "path": "timeline.json",
      "sha256": "4a37d7ee21764b107ff921846aa840a9c404bb2da3960ac161598f0f23a0b0ff",
      "bytes": 5542
    }
  ],
  "limitations": [
    "Read-only recorded local contract services with synthetic USD data. No native Salesforce, Stripe, NetSuite or Snowflake execution; no production or commercial results.",
    "Lifecycle, foundation delivery, process-death and operator-browser runs are separate evidence sets. Pinned source PR is unmerged; this viewer is not an independent certification of the source platform.",
    "Post-recovery billing/ERP totals are archived browser observations. Cash/ARR use versioned fixture arithmetic corroborated by executed assertions. Full recovery approval/attempt rows were not archived at this revision.",
    "Only the recorded finite scenario is checked. This does not establish general financial correctness, strict cross-system revocation atomicity, production HA or universal exactly-once delivery."
  ],
  "input_hashes": {
    "lifecycle.json": "6f653ecbdd1c38b80c2c9bf341da879edf25953e788c3317d8dee13f19cf8c72",
    "delivery.json": "4a10dee0182848cbf4817ab7e9eb8afe1e2eb692dbf0c9d196af94b04a80f3d0",
    "software.json": "f35dd49771f7f8ba493bd62c516686e6ceaace735347b325f136df9b27fbc189",
    "process-death.json": "7f634e61fafe0d9fa33527c2dcc3ee56a61965173b90a947c8096b9129b4e4b5",
    "history-rehydration.json": "a601e4b60054652a763ab5139905222c819d6d50bf54f9d9fedfdbff2b34dbc0",
    "publication-process-death.json": "88325acdb5d28bf76288b1fe68832e1b8fc1ae0abfbdda640568b9abcb33a1e2",
    "operator-browser.json": "283ccc2849826731532cf29f6d2b4ae2bcb0aedebb53dbb0cea2f3723882c381",
    "source-console.py": "f4b41a896e39dd9254b9f1c7c920f9c0b91d5549dcabd125e0857895f36a5818",
    "source-browser.cjs": "e60573e6ac25b6343fd472fb0f83cc6d81ecf98d149586cb7cb17fe066a58e19"
  },
  "reproduce": [
    "python scripts/import_integrity.py <pinned-revenue-integrity-git-checkout>",
    "python -m revenue_lab.cli verify web/evidence/revenue-integrity"
  ],
  "configuration_hash": "474ed1229b1ed54f18341ff49d0cc5d2b2302715bf7d3eeb4a2e498e9c79445c"
}
